{
  "artifact_id": "multiple-myeloma-trial-therapy-landscape-non-advice-gate-v0",
  "title": "Trial Therapy Landscape Non-Advice Gate v0",
  "artifact_class": "protocol",
  "blood_cancer_scope": [
    "multiple myeloma",
    "plasma-cell disease",
    "trial landscape",
    "therapy landscape",
    "product status context",
    "source freshness",
    "query provenance",
    "public projection",
    "case-to-cure pipeline",
    "public safety",
    "private-lab handoff"
  ],
  "claim_level": "open-question",
  "sources": [
    {
      "label": "Evidence Retrieval Packet v0",
      "url": "../evidence-retrieval-packet-v0.md",
      "accessed": "2026-04-16"
    },
    {
      "label": "Immune Therapy Sequencing And Access Boundary v0",
      "url": "immune-therapy-sequencing-access-boundary-v0.md",
      "accessed": "2026-04-16"
    },
    {
      "label": "Therapy Exposure Timeline Contract v0",
      "url": "therapy-exposure-timeline-contract-v0.md",
      "accessed": "2026-04-16"
    },
    {
      "label": "Molecular Immune Context Contract v0",
      "url": "../contexts/molecular-immune-context-contract-v0.md",
      "accessed": "2026-04-16"
    },
    {
      "label": "Measurement Normalization Contract v0",
      "url": "../measurements/measurement-normalization-contract-v0.md",
      "accessed": "2026-04-16"
    },
    {
      "label": "Case Feature Normalization Contract v0",
      "url": "../case-feature-normalization-contract-v0.md",
      "accessed": "2026-04-16"
    },
    {
      "label": "ClinicalTrials.gov Query Protocol v0",
      "url": "../../../protocols/clinicaltrials-gov-query-protocol-v0.md",
      "accessed": "2026-04-16"
    },
    {
      "label": "Trial-Landscape Record Schema v0",
      "url": "../../../schemas/trial-landscape-record-schema-v0.md",
      "accessed": "2026-04-16"
    },
    {
      "label": "Therapy Record Schema v0",
      "url": "../../../schemas/therapy-record-schema-v0.md",
      "accessed": "2026-04-16"
    },
    {
      "label": "Target Record Schema v0",
      "url": "../../../schemas/target-record-schema-v0.md",
      "accessed": "2026-04-16"
    },
    {
      "label": "Multiple Myeloma Treatment-Class Taxonomy v0",
      "url": "../../../taxonomies/multiple-myeloma-treatment-class-taxonomy-v0.md",
      "accessed": "2026-04-16"
    },
    {
      "label": "Source Registry v0",
      "url": "../../../sources/source-registry-v0.md",
      "accessed": "2026-04-16"
    },
    {
      "label": "Publication-Gate Checklist v0",
      "url": "../publication-gate-checklist-v0.md",
      "accessed": "2026-04-16"
    },
    {
      "label": "Case-To-Cure Adaptive Master Plan v0",
      "url": "../case-to-cure-adaptive-master-plan-v0.md",
      "accessed": "2026-04-16"
    },
    {
      "label": "Case-To-Cure Pipeline Blueprint v0",
      "url": "../case-to-cure-pipeline-blueprint-v0.md",
      "accessed": "2026-04-16"
    },
    {
      "label": "Case-To-Cure Stage Validator And Owner Map v0",
      "url": "../case-to-cure-stage-validator-map-v0.md",
      "accessed": "2026-04-16"
    },
    {
      "label": "Public Safety",
      "url": "../../../governance/PUBLIC_SAFETY.md",
      "accessed": "2026-04-16"
    },
    {
      "label": "Private-To-Public Workflow",
      "url": "../../../docs/private-to-public-workflow.md",
      "accessed": "2026-04-16"
    }
  ],
  "limitations": [
    "Research-use-only protocol gate.",
    "Public landscape shape only.",
    "Not an executable schema.",
    "Not a live trial search.",
    "Not a therapy explorer.",
    "Not a product dashboard.",
    "Not a registry monitor.",
    "Not a label monitor.",
    "Not a source scraper.",
    "Not an API workflow.",
    "Not a database.",
    "Not a backend.",
    "Not an account or public submission workflow.",
    "Not a real landscape record set.",
    "Not a trial matcher.",
    "Not an eligibility checker.",
    "Not a site finder.",
    "Not an availability checker.",
    "Not an access pathway.",
    "Not an expanded-access pathway.",
    "Not a treatment selector.",
    "Not a sequencing guide.",
    "Not an actionability record.",
    "Not an option ranking.",
    "Not medical advice.",
    "Not diagnostic guidance.",
    "Not prognosis guidance.",
    "Not treatment advice.",
    "Not trial advice.",
    "Not eligibility guidance.",
    "Not availability guidance.",
    "Not expanded-access guidance.",
    "Not access guidance.",
    "Not monitoring guidance.",
    "Not urgency or emergency guidance.",
    "Not safety-management guidance.",
    "Does not run literature, registry, regulatory, labeling, dataset, therapy, product, or trial searches.",
    "Does not process, normalize, store, route, publish, match, compare, rank, verify, or authorize use of real case-linked landscape context.",
    "Does not contain patient-identifying data, private records, portal exports, molecular reports, pathology reports, flow reports, genomics reports, images, notes, raw assay values, therapy histories, exact dates tied to a person, facilities, clinicians, sponsor contacts, contact details, private case IDs, private workspace paths, private prompts, or re-identification keys.",
    "Does not authorize clinical interpretation, trial-status verification, sponsor or site verification, patient matching, trial matching, target actionability, source ranking, evidence ranking, target ranking, mechanism ranking, product ranking, therapy ranking, trial ranking, option ranking, private-lab work, legal clearance, regulatory readiness, security readiness, retention decisions, emergency handling, or publication of case-derived learning.",
    "Does not validate candidate hypothesis, multidisciplinary review, monitoring-plan, or public-learning extraction semantics.",
    "Does not claim that multiple myeloma has been cured or that a vaccine has been found."
  ],
  "private_upstream": "curing-blood-cancer-lab/export-candidates/multiple-myeloma-trial-therapy-landscape-non-advice-gate-v0.md"
}
