{
  "artifact_id": "residual-state-contradiction-mining-note-v0",
  "title": "Residual-State Contradiction Mining Note v0",
  "artifact_class": "dataset",
  "blood_cancer_scope": [
    "multiple myeloma",
    "measurable residual disease",
    "residual biological state",
    "contradiction mining",
    "geometry proof",
    "no human outreach"
  ],
  "claim_level": "open-question",
  "sources": [
    {
      "label": "MRD Resistance Geometry Proof Plan v0",
      "url": "mrd-resistance-geometry-proof-plan-v0.md",
      "accessed": "2026-04-20"
    },
    {
      "label": "MRD Resistance Geometry Contradiction Mining Task Queue v0",
      "url": "../public-tasks/mrd-resistance-geometry-contradiction-mining-task-queue-v0.md",
      "accessed": "2026-04-20"
    },
    {
      "label": "Cui 2024 MRD clonal evolution source",
      "url": "https://pubmed.ncbi.nlm.nih.gov/38900040/",
      "accessed": "2026-04-19"
    },
    {
      "label": "Cohen 2021 single-cell resistance source",
      "url": "https://pubmed.ncbi.nlm.nih.gov/33619369/",
      "accessed": "2026-04-19"
    },
    {
      "label": "Wang 2025 lipid metabolism source",
      "url": "https://pubmed.ncbi.nlm.nih.gov/40110197/",
      "accessed": "2026-04-20"
    },
    {
      "label": "Lu 2024 signaling pathways source",
      "url": "https://pubmed.ncbi.nlm.nih.gov/38961036/",
      "accessed": "2026-04-20"
    }
  ],
  "limitations": [
    "Research artifact only.",
    "Not medical advice.",
    "Not diagnostic guidance.",
    "Not a monitoring recommendation.",
    "Not a treatment recommendation.",
    "Not a trial recommendation.",
    "Not a patient-specific MRD interpretation.",
    "Does not rank pathways, mechanisms, sources, assays, or therapies.",
    "Does not claim clinical validation.",
    "Does not claim that multiple myeloma has been cured."
  ],
  "private_upstream": "../curing-blood-cancer-lab/export-candidates/mrd-resistance-geometry-phase-5-discrimination-v0.md"
}
