{
  "artifact_id": "mrd-resistance-geometry-intelligence-audit-packet-v0",
  "title": "MRD Resistance Geometry Intelligence Audit Packet v0",
  "artifact_class": "protocol",
  "blood_cancer_scope": [
    "multiple myeloma",
    "measurable residual disease",
    "clonal evolution",
    "therapy resistance",
    "geometry pilot",
    "internal adversarial intelligence audit",
    "no human outreach"
  ],
  "claim_level": "open-question",
  "sources": [
    {
      "label": "MRD Resistance Geometry Phase Plan v0",
      "url": "mrd-resistance-geometry-phase-plan-v0.md",
      "accessed": "2026-04-20"
    },
    {
      "label": "MRD Resistance Geometry Axis Revision Decision v0",
      "url": "mrd-resistance-geometry-axis-revision-decision-v0.md",
      "accessed": "2026-04-20"
    },
    {
      "label": "MRD Resistance Geometry Coverage Report v0",
      "url": "mrd-resistance-geometry-coverage-v0.md",
      "accessed": "2026-04-20"
    },
    {
      "label": "MRD Resistance Geometry Second-Source Task Queue v0",
      "url": "../public-tasks/mrd-resistance-geometry-second-source-task-queue-v0.md",
      "accessed": "2026-04-20"
    },
    {
      "label": "Cui 2024 MRD clonal evolution source",
      "url": "https://pubmed.ncbi.nlm.nih.gov/38900040/",
      "accessed": "2026-04-19"
    },
    {
      "label": "Martinez-Lopez 2020 MRD dynamics source",
      "url": "https://pubmed.ncbi.nlm.nih.gov/32706892/",
      "accessed": "2026-04-19"
    },
    {
      "label": "Cohen 2021 single-cell resistance source",
      "url": "https://pubmed.ncbi.nlm.nih.gov/33619369/",
      "accessed": "2026-04-19"
    },
    {
      "label": "Cohen 2021 PubMed Central full text",
      "url": "https://pmc.ncbi.nlm.nih.gov/articles/PMC7612793/",
      "accessed": "2026-04-19"
    }
  ],
  "limitations": [
    "Research artifact only.",
    "Not medical advice.",
    "Not diagnostic guidance.",
    "Not a treatment recommendation.",
    "Not a trial recommendation.",
    "Not a patient-specific MRD interpretation.",
    "Does not rank mechanisms, assays, therapies, or sources by clinical importance.",
    "Does not claim that multiple myeloma has been cured.",
    "No external human outreach is required or scheduled.",
    "Internal audit status is not clinical validation."
  ],
  "private_upstream": "../curing-blood-cancer-lab/export-candidates/mrd-resistance-geometry-intelligence-audit-packet-v0.md"
}
