{
  "artifact_id": "measurement-refusal-validator-skeleton-v0",
  "title": "Measurement Refusal Validator Skeleton v0",
  "artifact_class": "protocol",
  "blood_cancer_scope": [
    "multiple myeloma",
    "plasma-cell disease",
    "measurable residual disease",
    "measurement state",
    "assay quality",
    "specimen quality",
    "model-output refusal",
    "validator skeleton",
    "public safety"
  ],
  "claim_level": "open-question",
  "sources": [
    {
      "label": "Measurement Refusal Output Route Table v0",
      "url": "./measurement-refusal-output-route-table-v0.md",
      "accessed": "2026-04-20"
    },
    {
      "label": "Measurement Refusal Output Fixture v0",
      "url": "../../../examples/measurement-refusal-output-fixture-v0.json",
      "accessed": "2026-04-20"
    },
    {
      "label": "Measurement Refusal Validator Skeleton Tool v0",
      "url": "../../../tools/measurement_refusal_validator_skeleton.py",
      "accessed": "2026-04-20"
    },
    {
      "label": "Measurement Refusal Validator Skeleton Report v0",
      "url": "../../../examples/measurement-refusal-validator-skeleton-report-v0.json",
      "accessed": "2026-04-20"
    },
    {
      "label": "Myeloma State Validator Rule Map v0",
      "url": "../myeloma-state-validator-rule-map-v0.md",
      "accessed": "2026-04-20"
    },
    {
      "label": "Measurement Refusal Negative Safety Fixtures v0",
      "url": "./measurement-refusal-negative-safety-fixtures-v0.md",
      "accessed": "2026-04-20"
    },
    {
      "label": "Measurement Refusal Negative Safety Fixtures Dataset v0",
      "url": "../../../examples/measurement-refusal-negative-safety-fixtures-v0.json",
      "accessed": "2026-04-20"
    },
    {
      "label": "Measurement Refusal Negative Safety Fixture Check v0",
      "url": "../../../tools/check_measurement_refusal_negative_safety_fixtures.py",
      "accessed": "2026-04-20"
    },
    {
      "label": "Measurement Refusal Wrapper Integration Dry Run v0",
      "url": "./measurement-refusal-wrapper-integration-dry-run-v0.md",
      "accessed": "2026-04-20"
    },
    {
      "label": "Measurement Refusal Wrapper Integration Dry Run Dataset v0",
      "url": "../../../examples/measurement-refusal-wrapper-integration-dry-run-v0.json",
      "accessed": "2026-04-20"
    },
    {
      "label": "Measurement Refusal Wrapper Integration Dry Run Check v0",
      "url": "../../../tools/check_measurement_refusal_wrapper_integration_dry_run.py",
      "accessed": "2026-04-20"
    },
    {
      "label": "Measurement Refusal Wrapper Negative Safety Fixtures v0",
      "url": "./measurement-refusal-wrapper-negative-safety-fixtures-v0.md",
      "accessed": "2026-04-20"
    },
    {
      "label": "Measurement Refusal Wrapper Negative Safety Fixtures Dataset v0",
      "url": "../../../examples/measurement-refusal-wrapper-negative-safety-fixtures-v0.json",
      "accessed": "2026-04-20"
    },
    {
      "label": "Measurement Refusal Wrapper Negative Safety Fixture Check v0",
      "url": "../../../tools/check_measurement_refusal_wrapper_negative_safety_fixtures.py",
      "accessed": "2026-04-20"
    }
  ],
  "limitations": [
    "Research-use-only validator skeleton.",
    "Synthetic structural validation only.",
    "Not medical advice.",
    "Not diagnostic guidance.",
    "Not MRD interpretation.",
    "Not response assessment.",
    "Not prognosis guidance.",
    "Not monitoring guidance.",
    "Not treatment advice.",
    "Not trial advice.",
    "Not eligibility guidance.",
    "Not matching or ranking.",
    "Not report interpretation.",
    "Not laboratory validation.",
    "Not imaging interpretation.",
    "Not biopsy interpretation.",
    "Not publication authorization.",
    "Does not process real reports, raw values, scans, biopsies, exact person-linked dates, private paths, accessions, or records.",
    "Does not implement executable clinical validation, model scoring, prediction, calibration, benchmarking, or deployment.",
    "Does not clear human-review, expert-review, private-lab, clinical-team, legal, regulatory, publication, or model-governance gates.",
    "Does not claim that multiple myeloma has been cured."
  ],
  "private_upstream": "../curing-blood-cancer-lab/export-candidates/measurement-refusal-validator-skeleton-v0.md"
}
