{
  "artifact_id": "multiple-myeloma-consent-privacy-security-retention-gate-v0",
  "title": "Consent Privacy Security Retention Gate v0",
  "artifact_class": "protocol",
  "blood_cancer_scope": [
    "multiple myeloma",
    "plasma-cell disease",
    "caregiver intake",
    "consent boundary",
    "privacy boundary",
    "security boundary",
    "retention boundary",
    "case-to-cure pipeline",
    "public safety",
    "private-lab handoff"
  ],
  "claim_level": "open-question",
  "sources": [
    {
      "label": "Caregiver Intake Public Projection Validator v0",
      "url": "./caregiver-intake-public-projection-validator-v0.md",
      "accessed": "2026-04-16"
    },
    {
      "label": "Caregiver Intake Public Projection Checklist v0",
      "url": "./caregiver-intake-public-projection-checklist-v0.md",
      "accessed": "2026-04-16"
    },
    {
      "label": "Private Intake Schema Contract v0",
      "url": "./private-intake-schema-contract-v0.md",
      "accessed": "2026-04-16"
    },
    {
      "label": "Static Synthetic Caregiver Prototype Plan v0",
      "url": "./static-synthetic-caregiver-prototype-plan-v0.md",
      "accessed": "2026-04-16"
    },
    {
      "label": "Caregiver Case Intake Product Spec v0",
      "url": "./caregiver-case-intake-product-spec-v0.md",
      "accessed": "2026-04-16"
    },
    {
      "label": "Case-To-Cure Adaptive Master Plan v0",
      "url": "../case-to-cure-adaptive-master-plan-v0.md",
      "accessed": "2026-04-16"
    },
    {
      "label": "Case-To-Cure Pipeline Blueprint v0",
      "url": "../case-to-cure-pipeline-blueprint-v0.md",
      "accessed": "2026-04-16"
    },
    {
      "label": "Case-To-Cure Stage Validator And Owner Map v0",
      "url": "../case-to-cure-stage-validator-map-v0.md",
      "accessed": "2026-04-16"
    },
    {
      "label": "Case-Specific Private-Lab Blocker Register v0",
      "url": "../case-specific-private-lab-blocker-register-v0.md",
      "accessed": "2026-04-16"
    },
    {
      "label": "Publication-Gate Checklist v0",
      "url": "../publication-gate-checklist-v0.md",
      "accessed": "2026-04-16"
    },
    {
      "label": "Public Review And Release Gate v0",
      "url": "../public-review-release-gate-v0.md",
      "accessed": "2026-04-16"
    },
    {
      "label": "Private-To-Public Workflow",
      "url": "../../../docs/private-to-public-workflow.md",
      "accessed": "2026-04-16"
    },
    {
      "label": "Public Safety",
      "url": "../../../governance/PUBLIC_SAFETY.md",
      "accessed": "2026-04-16"
    }
  ],
  "limitations": [
    "Research-use-only gate spec.",
    "Public boundary spec only.",
    "Not a consent form.",
    "Not a privacy notice.",
    "Not a security policy.",
    "Not a retention policy.",
    "Not a legal, regulatory, or institutional review.",
    "Not a clinical workflow.",
    "Not a clinician assignment process.",
    "Not an emergency or urgent-care service.",
    "Not a live backend.",
    "Not a database.",
    "Not an upload path.",
    "Not an account or access-control implementation.",
    "Not publication approval.",
    "Not medical advice.",
    "Not diagnostic guidance.",
    "Not prognosis guidance.",
    "Not treatment advice.",
    "Not trial advice.",
    "Not eligibility guidance.",
    "Not expanded-access guidance.",
    "Not monitoring guidance.",
    "Not urgency or emergency guidance.",
    "Does not collect, store, route, transform, publish, or authorize use of real case data.",
    "Does not contain patient-identifying data, private records, portal exports, reports, images, notes, exact dates tied to a person, contact details, consent records, private case IDs, private workspace paths, or re-identification keys.",
    "Does not authorize clinical interpretation, patient matching, trial matching, option ranking, private-lab work, legal clearance, regulatory readiness, security readiness, retention decisions, emergency handling, or publication of case-derived learning.",
    "Does not claim that multiple myeloma has been cured or that a vaccine has been found."
  ],
  "private_upstream": "curing-blood-cancer-lab/export-candidates/multiple-myeloma-consent-privacy-security-retention-gate-v0.md"
}
