{
  "artifact_id": "mrd-resistance-geometry-contradiction-mining-task-queue-v0",
  "title": "MRD Resistance Geometry Contradiction Mining Task Queue v0",
  "artifact_class": "dataset",
  "blood_cancer_scope": [
    "multiple myeloma",
    "measurable residual disease",
    "clonal evolution",
    "therapy resistance",
    "geometry pilot",
    "contradiction mining",
    "internal adversarial intelligence audit"
  ],
  "claim_level": "open-question",
  "sources": [
    {
      "label": "MRD Resistance Geometry Intelligence Audit Packet v0",
      "url": "../mechanisms/mrd-resistance-geometry-intelligence-audit-packet-v0.md",
      "accessed": "2026-04-20"
    },
    {
      "label": "MRD Resistance Geometry Intelligence Audit Results v0",
      "url": "../mechanisms/mrd-resistance-geometry-intelligence-audit-results-v0.md",
      "accessed": "2026-04-20"
    },
    {
      "label": "MRD Resistance Geometry Coverage Report v0",
      "url": "../mechanisms/mrd-resistance-geometry-coverage-v0.md",
      "accessed": "2026-04-20"
    },
    {
      "label": "MRD Resistance Geometry Second-Source Task Queue v0",
      "url": "mrd-resistance-geometry-second-source-task-queue-v0.md",
      "accessed": "2026-04-20"
    },
    {
      "label": "Cui 2024 MRD clonal evolution source",
      "url": "https://pubmed.ncbi.nlm.nih.gov/38900040/",
      "accessed": "2026-04-19"
    },
    {
      "label": "Martinez-Lopez 2020 MRD dynamics source",
      "url": "https://pubmed.ncbi.nlm.nih.gov/32706892/",
      "accessed": "2026-04-20"
    },
    {
      "label": "Cohen 2021 single-cell resistance source",
      "url": "https://pubmed.ncbi.nlm.nih.gov/33619369/",
      "accessed": "2026-04-19"
    },
    {
      "label": "Li 2025 single-cell myeloma review source",
      "url": "https://pubmed.ncbi.nlm.nih.gov/40002248/",
      "accessed": "2026-04-20"
    },
    {
      "label": "MRD Trajectory Contradiction Mining Note v0",
      "url": "../mechanisms/mrd-trajectory-contradiction-mining-note-v0.md",
      "accessed": "2026-04-20"
    },
    {
      "label": "Clone-State Coupling Contradiction Mining Note v0",
      "url": "../mechanisms/clone-state-coupling-contradiction-mining-note-v0.md",
      "accessed": "2026-04-20"
    },
    {
      "label": "Wang 2025 lipid metabolism source",
      "url": "https://pubmed.ncbi.nlm.nih.gov/40110197/",
      "accessed": "2026-04-20"
    },
    {
      "label": "Lu 2024 signaling pathways source",
      "url": "https://pubmed.ncbi.nlm.nih.gov/38961036/",
      "accessed": "2026-04-20"
    },
    {
      "label": "Residual-State Contradiction Mining Note v0",
      "url": "../mechanisms/residual-state-contradiction-mining-note-v0.md",
      "accessed": "2026-04-20"
    },
    {
      "label": "MRD Geometry Claim Upgrade Blocker Ledger v0",
      "url": "../mechanisms/mrd-geometry-claim-upgrade-blocker-ledger-v0.md",
      "accessed": "2026-04-20"
    }
  ],
  "limitations": [
    "Research artifact only.",
    "Not medical advice.",
    "Not diagnostic guidance.",
    "Not a treatment recommendation.",
    "Not a monitoring recommendation.",
    "Not a trial recommendation.",
    "Not a patient-specific MRD interpretation.",
    "Does not rank mechanisms, assays, therapies, sources, or tasks by clinical importance.",
    "Does not claim that multiple myeloma has been cured.",
    "No external human outreach is required or scheduled."
  ],
  "private_upstream": "../curing-blood-cancer-lab/export-candidates/mrd-resistance-geometry-phase-5-discrimination-v0.md"
}
