{
  "artifact_id": "measurement-refusal-output-schema-v0",
  "title": "Measurement Refusal Output Schema v0",
  "artifact_class": "schema",
  "blood_cancer_scope": [
    "multiple myeloma",
    "plasma-cell disease",
    "measurable residual disease",
    "measurement state",
    "assay quality",
    "specimen quality",
    "model-output refusal",
    "validator pressure",
    "public safety"
  ],
  "claim_level": "open-question",
  "sources": [
    {
      "label": "Measurement State Refusal Fixtures v0",
      "url": "../examples/measurement-state-refusal-fixtures-v0.json",
      "accessed": "2026-04-20"
    },
    {
      "label": "Assay Specimen Quality Failure Mode Checklist v0",
      "url": "../disease-programs/multiple-myeloma/measurements/assay-specimen-quality-failure-mode-checklist-v0.md",
      "accessed": "2026-04-20"
    },
    {
      "label": "Model Output Boundary Wrapper v0",
      "url": "../disease-programs/multiple-myeloma/model-output-boundary-wrapper-v0.md",
      "accessed": "2026-04-20"
    },
    {
      "label": "Myeloma State Validator Rule Map v0",
      "url": "../disease-programs/multiple-myeloma/myeloma-state-validator-rule-map-v0.md",
      "accessed": "2026-04-20"
    }
  ],
  "limitations": [
    "Research-use-only output schema.",
    "Synthetic fixture output shape only.",
    "Not medical advice.",
    "Not diagnostic guidance.",
    "Not MRD interpretation.",
    "Not response assessment.",
    "Not prognosis guidance.",
    "Not monitoring guidance.",
    "Not treatment advice.",
    "Not trial advice.",
    "Not eligibility guidance.",
    "Not matching or ranking.",
    "Not report interpretation.",
    "Not laboratory validation.",
    "Not imaging interpretation.",
    "Not biopsy interpretation.",
    "Not publication authorization.",
    "Does not process real reports, raw values, scans, biopsies, exact person-linked dates, private paths, accessions, or records.",
    "Does not implement executable clinical validation, model scoring, prediction, calibration, benchmarking, or deployment.",
    "Does not clear human-review, expert-review, private-lab, clinical-team, legal, regulatory, publication, or model-governance gates.",
    "Does not claim that multiple myeloma has been cured."
  ],
  "private_upstream": "../curing-blood-cancer-lab/export-candidates/measurement-refusal-output-schema-v0.md"
}
