{
  "artifact_id": "multiple-myeloma-static-synthetic-caregiver-prototype-plan-v0",
  "title": "Static Synthetic Caregiver Prototype Plan v0",
  "artifact_class": "protocol",
  "blood_cancer_scope": [
    "multiple myeloma",
    "plasma-cell disease",
    "caregiver intake",
    "static prototype",
    "synthetic fixture",
    "case-to-cure pipeline",
    "public safety"
  ],
  "claim_level": "open-question",
  "sources": [
    {
      "label": "Private Intake Schema Contract v0",
      "url": "./private-intake-schema-contract-v0.md",
      "accessed": "2026-04-16"
    },
    {
      "label": "Caregiver Case Intake Product Spec v0",
      "url": "./caregiver-case-intake-product-spec-v0.md",
      "accessed": "2026-04-16"
    },
    {
      "label": "Caregiver Intake Public Projection Checklist v0",
      "url": "./caregiver-intake-public-projection-checklist-v0.md",
      "accessed": "2026-04-16"
    },
    {
      "label": "Multiple Myeloma Synthetic Caregiver Intake v0",
      "url": "../../../examples/multiple-myeloma-synthetic-caregiver-intake-v0.json",
      "accessed": "2026-04-16"
    },
    {
      "label": "Case-To-Cure Adaptive Master Plan v0",
      "url": "../case-to-cure-adaptive-master-plan-v0.md",
      "accessed": "2026-04-16"
    },
    {
      "label": "Case-To-Cure Pipeline Blueprint v0",
      "url": "../case-to-cure-pipeline-blueprint-v0.md",
      "accessed": "2026-04-16"
    },
    {
      "label": "Case-To-Cure Loop Governor Handoff v0",
      "url": "../case-to-cure-loop-governor-handoff-v0.md",
      "accessed": "2026-04-16"
    },
    {
      "label": "Publication-Gate Checklist v0",
      "url": "../publication-gate-checklist-v0.md",
      "accessed": "2026-04-16"
    },
    {
      "label": "Private-To-Public Workflow",
      "url": "../../../docs/private-to-public-workflow.md",
      "accessed": "2026-04-16"
    },
    {
      "label": "Public Safety",
      "url": "../../../governance/PUBLIC_SAFETY.md",
      "accessed": "2026-04-16"
    }
  ],
  "limitations": [
    "Research-use-only prototype plan.",
    "Static documentation only.",
    "Not a public form.",
    "Not a live demo.",
    "Not a backend or database design.",
    "Not an upload workflow.",
    "Not medical advice.",
    "Not diagnostic guidance.",
    "Not prognosis guidance.",
    "Not treatment advice.",
    "Not trial advice.",
    "Not eligibility guidance.",
    "Not expanded-access guidance.",
    "Not monitoring guidance.",
    "Not urgency guidance.",
    "Does not collect, store, transmit, publish, or authorize use of real case data.",
    "Does not contain patient-identifying data, private records, portal exports, reports, images, notes, dates tied to a person, contact details, free-text case details, consent records, private case IDs, or re-identification keys.",
    "Does not authorize clinical interpretation, case packet assembly, patient matching, trial matching, option ranking, or publication of case-derived learning.",
    "Does not claim that multiple myeloma has been cured or that a vaccine has been found."
  ],
  "private_upstream": "curing-blood-cancer-lab/export-candidates/multiple-myeloma-static-synthetic-caregiver-prototype-plan-v0.md"
}
